{
  "eventName": "ShippingCreated",
  "eventVersion": 1,
  "eventId": "13572468-2468-1357-2468-135724681357",
  "correlationId": "c0a8e2b6-3c6a-4d7e-9c8f-1f2e3d4c5b6a",
  "causationId": "abcd1234-ab12-cd34-ef56-abcdef123456",
  "producer": "shipping-service",
  "partitionKey": "f1e2d3c4-b5a6-7988-99aa-bbccddeeff00",
  "sequence": 5,
  "occurredAt": "2024-05-01T12:45:00Z",
  "schema": "contracts/events/shipping/ShippingCreated.v1.payload.schema.json",
  "payload": {
    "shippingId": "13572468-2468-1357-2468-135724681357",
    "orderId": "f1e2d3c4-b5a6-7988-99aa-bbccddeeff00",
    "userId": "1a2b3c4d-5e6f-7081-920a-bc0d1e2f3a4b",
    "address": {
      "line1": "123 Market St",
      "city": "San Francisco",
      "state": "CA",
      "postalCode": "94103",
      "country": "US"
    },
    "shippingMethod": "express",
    "carrier": "UPS",
    "createdAt": "2024-05-01T12:44:45Z"
  }
}
