{
  "eventName": "StockDepleted",
  "eventVersion": 1,
  "eventId": "99990000-aaaa-bbbb-cccc-ddddeeeeffff",
  "correlationId": "0f1e2d3c-4b5a-6978-8899-aabbccddeeff",
  "causationId": "0f1e2d3c-4b5a-6978-8899-aabbccddeeff",
  "producer": "inventory-service",
  "partitionKey": "9a8b7c6d-5e4f-3a2b-1c0d-9e8f7a6b5c4d",
  "sequence": 3,
  "occurredAt": "2024-05-01T12:38:10Z",
  "schema": "contracts/events/inventory/StockDepleted.v1.payload.schema.json",
  "payload": {
    "orderId": "f1e2d3c4-b5a6-7988-99aa-bbccddeeff00",
    "userId": "1a2b3c4d-5e6f-7081-920a-bc0d1e2f3a4b",
    "depleted": [
      {
        "productId": "9a8b7c6d-5e4f-3a2b-1c0d-9e8f7a6b5c4d",
        "requested": 2,
        "available": 0
      }
    ],
    "reserved": [
      {
        "productId": "123e4567-e89b-12d3-a456-426614174000",
        "quantity": 1
      }
    ],
    "timestamp": "2024-05-01T12:38:10Z"
  }
}
