{
  "eventName": "OrderCompleted",
  "eventVersion": 1,
  "eventId": "abcd1234-ab12-cd34-ef56-abcdef123456",
  "correlationId": "0f1e2d3c-4b5a-6978-8899-aabbccddeeff",
  "causationId": "12345678-90ab-cdef-1234-567890abcdef",
  "producer": "order-service",
  "partitionKey": "f1e2d3c4-b5a6-7988-99aa-bbccddeeff00",
  "sequence": 6,
  "occurredAt": "2024-05-01T12:50:00Z",
  "schema": "contracts/events/order/OrderCompleted.v1.payload.schema.json",
  "payload": {
    "orderId": "f1e2d3c4-b5a6-7988-99aa-bbccddeeff00",
    "userId": "1a2b3c4d-5e6f-7081-920a-bc0d1e2f3a4b",
    "timestamp": "2024-05-01T12:49:45Z"
  }
}
