{
  "eventName": "CartCheckedOut",
  "eventVersion": 1,
  "eventId": "6c6f05ae-2d7a-4f5c-9d1a-7f7f2f7a3af1",
  "correlationId": "c0a8e2b6-3c6a-4d7e-9c8f-1f2e3d4c5b6a",
  "causationId": "46b91f4f-6e4f-4c1b-9f2c-9d1b4f6a7e5d",
  "producer": "cart-service",
  "partitionKey": "7d8e9f10-1112-1314-1516-171819202122",
  "sequence": 1,
  "occurredAt": "2024-05-01T12:34:56Z",
  "schema": "contracts/events/cart/CartCheckedOut.v1.payload.schema.json",
  "payload": {
    "cartId": "7d8e9f10-1112-1314-1516-171819202122",
    "userId": "1a2b3c4d-5e6f-7081-920a-bc0d1e2f3a4b",
    "items": [
      {
        "productId": "9a8b7c6d-5e4f-3a2b-1c0d-9e8f7a6b5c4d",
        "quantity": 2,
        "price": 49.99
      },
      {
        "productId": "123e4567-e89b-12d3-a456-426614174000",
        "quantity": 1,
        "price": 199.99
      }
    ],
    "totalAmount": 299.97,
    "timestamp": "2024-05-01T12:34:56Z"
  }
}
